;Indice;Domanda ChatGTP;Risposta ChatGTP;Valutazione ChatGTP
512;25;How can guests cancel guaranteed reservations without incurring penalties, and what happens if the cancellation is not informed in time?;Cancellations for guaranteed reservations within 72 hours incur a penalty of one night's fare if not informed in time.;G
513;25;What is the penalty for smoking in rooms and public areas, and are there designated smoking areas?;"Smoking in rooms/public areas prohibited; penalty is $200 (14,000 soms); designated smoking areas in the courtyard.";G
514;25;"During what periods is the ""First night – No refund"" rate applied, and what are the conditions for changing stay dates during this period?";"""First night – No refund"" rate applies during specific periods (01.06 – 31.08, 25.12 – 08.01, 01";G
515;26;"What is the definition of ""Reservation"" in the context of the AZIMUT Hotels Reservation Policy?";"""Reservation"" refers to the assignment to the Consumer of a room in the Hotel or Sanatorium based on the terms defined by the application of the Customer or the Consumer, confirmed by the Contractor.";G
516;26;"What is the role of an ""Acceptance"" in the AZIMUT Hotels Reservation Policy?";"""Acceptance"" is the consent of the person interested in purchasing hotel services to enter into a contract.";G
517;26;"What does ""Hotel"" or ""Sanatorium"" refer to in the context of these rules?";"""Hotel"" or ""Sanatorium"" refers to an accommodation facility in the AZIMUT Hotels chain, providing hotel services and belonging to the types of hotels stipulated by the regulation on hotel classification.";G
518;26;What are the different methods of booking a room in the Hotel or Sanatorium according to the rules?;The methods of booking include online applications on the website, sending an application by email or phone, directly at the Hotel or Sanatorium, and on online portals selling hotel services.;G
519;26;"How is a reservation considered ""guaranteed,"" and what are the conditions for it?";"A reservation is considered ""guaranteed"" if the Customer pays the cost of a day of stay no later than 3:00 p.m";G
520;26;"What is the role of the ""Customer"" in the reservation process according to the rules?";"The ""Customer"" is an individual or a legal entity intending to order or purchase hotel services for the benefit of the consumer.";G
521;26;"What is the significance of a ""Guaranteed reservation"" and how is it canceled without a fee?";"""Guaranteed reservation"" is significant as it expects payment from the Consumer and can be canceled without a fee 24 hours before arrival.";G
522;26;How is a reservation considered canceled in the case of non-arrival or late arrival?;A reservation is considered canceled in case of non-arrival, late arrival, or failure to make an advance payment.;G
523;26;"How is the term ""Price Lists"" defined, and what information do they include?";"""Price Lists"" are internal acts of the Contractors establishing room categories, prices, the cost of extra services, and other relevant information.";G
524;26;What is the procedure for cancellation of a reservation, and under what circumstances can it be canceled?;The procedure for cancellation involves failure to make an advance payment, sending a cancellation notification, non-arrival of the Guest(s) for guaranteed reservations, and non-arrival by 3:00 p.m;G
525;26;"How is the cost of a room per day calculated, and what does ""twenty-four hours"" mean in this context?";"The cost of a room per day is calculated based on the check-in and check-out time, with ""twenty-four hours"" defined as the period from check-in time to the check-out time on the day following arrival.";G
526;26;How can a Customer change information in a valid (confirmed) application, and within what timeframe?;To change information in a confirmed application, the Customer must send an application to the Contractor at least 24 hours in advance.;G
527;26;What information does the confirmation of reservation include, and how is it communicated to the Customer?;Confirmation includes room details, pricing, booking conditions, and is sent via information messages to the Customer's email, messengers, and posted on the Website.;G
528;26;What are the two types of reservations used in Hotels and Sanatoriums, and how do they differ?;"Two types of reservations are ""Guaranteed reservation"" (requiring advance payment) and ""Non-guaranteed booking"" (no advance payment, canceled by 3:00 p.m";G
529;26;How can a Customer obtain a refund for a canceled reservation, and what is the process?;To obtain a refund, the Customer needs to fill out and send a refund application to the hotel by email, which will be processed within 5 working days.;G
530;26;Can the AZIMUT Hotels Company LLC unilaterally change the rules, and when do such changes come into force?;AZIMUT Hotels Company LLC can unilaterally change the Rules at any time without special notice, with changes effective from the posting date on the Website, and the Customer is responsible for monitoring such changes.;G
531;26;What happens if the invoice is not paid by the Customer in due time according to the rules?;If the invoice is not paid in due time, the reservation is considered non-guaranteed, and payment is made at the current rate on the date of arrival.;G
532;26;"Who is defined as the ""Consumer"" or ""Guest"" in the AZIMUT Hotels Reservation Policy?";"""Consumer"" or ""Guest"" is an individual intending to order or purchase hotel services for personal needs not related to business activities.";G
533;26;"What is the significance of a ""Public offer"" in the context of these rules?";"A ""Public offer"" is an offer to an unlimited number of persons interested in purchasing hotel services, constituting the Contractor's offer to conclude a contract.";G
534;26;"How does Limited Liability Company ""AZIMUT Hotels Company"" act in the context of these rules?";"Limited Liability Company ""AZIMUT Hotels Company"" acts based on powers of attorney issued by the Contractors.";G
535;27;Since when has Guesthouse Kolinska been 100% Smoke-Free?;100% Smoke-Free since 2017.;G
536;27;What is the policy for credit card authorization by private third parties?;"Generally not permitted; specific procedures for paying on behalf of a family member.";G
537;27;How is tax exemption handled for guests with GSA payment cards?;Taxed or exempt based on individual GSA payment card status.;G
538;27;What is the Tourist Tax for visitors to Bled municipality mentioned in the text?;313 €;S
539;27;What is the penalty for smoking in prohibited areas, according to the policy?;Minimum fee of 200€, considered house rule violence.;G
540;27;Are pets allowed in Guesthouse Kolinska?;Not allowed.;G
541;27;What are the check-in requirements, particularly regarding age and identification?;Guests must be 18 years old, provide valid government-issued photo ID, and a signed, pre-approved credit card.;G
542;27;How is the check-out procedure conducted?;Guests need to check out with the Front Desk;G
543;27;What happens if a guest checks out in the early hours before 7:30?;"Guests checking out before 7:30 must drop the room key in the mailbox; early checkout is not subject to reimbursement.";G
544;27;Does Guesthouse Kolinska accommodate special requests for room preferences?;"Effort to honor special requests; availability not guaranteed in advance.";G
545;27;What is the penalty for cooking in a guest room, and what appliances are prohibited?;Minimum fee of 200€, cooking appliances prohibited.;G
546;27;What is the requirement for guaranteed reservations, and what credit cards are accepted?;Valid major credit card, guests must be 18 years or older;G
547;27;What is the check-in time at Guesthouse Kolinska, and what happens after 20:00 for late arrivals?;16:00 to 20:00;G
548;27;Is early check-in available, and is there an extra charge for guaranteed early check-in?;Based on availability, extra charge for guaranteed early check-in.;G
549;27;What is the pre-authorization process at check-in, and how long does it take for the hold to be released?;Pre-authorization of credit/debit cards for the full amount of the intended stay, plus tax.;G
550;27;What payment methods are accepted, and are checks and foreign currency allowed?;Reservations and registration must be guaranteed with a major credit card (Visa and Master Card);G
551;27;What is the quiet hours policy, and what actions can be taken if there is a disruptive guest?;22:00 through 7:30;S
552;27;What is the check-out time at Guesthouse Kolinska?;11:00;G
553;27;What information is required for guest registration?;Requires valid contact information, including name, address, phone number, and signature.;G
554;27;Under what circumstances does Guesthouse Kolinska reserve the right to refuse service?;Reserved for reasons like non-payment, intoxication, disturbance, etc.;G
574;29;In what form is the accommodation contract always concluded, according to the text?;The accommodation contract is always concluded in written form;G
575;29;How does the text describe the rights and obligations of contractual parties not expressly regulated by the accommodation contract?;The rights and obligations of the contractual parties not expressly regulated by the accommodation contract are covered by these Accommodation Rules and the price list of services of the Lodging Provider;G
576;29;What is the Guest obligated to do upon arrival at the hotel reception?;Upon arrival, the Guest is obliged to announce their arrival to the hotel reception, present ID, passport, or proof of identity, pay the accommodation price, and provide a deposit if required.;G
577;29;What are the restrictions imposed on the Guest in terms of using and handling certain items within the accommodation premises?;The Guest is restricted from making substantial changes to accommodation premises, taking away equipment, using unauthorized appliances, and leaving the premises for another person.;G
578;29;In case of damage caused by the Guest exceeding the paid deposit, what is the Guest obliged to do?;If the value of damage exceeds the deposit, the Guest must pay the difference to the Provider.;G
579;29;What safety measures and plans should the Guest be aware of, according to the text?;The Guest should be aware of safety regulations and the evacuation plan in case of fire.;G
580;29;By what time is the Guest obliged to leave the room on the day of departure?;The Guest is obliged to leave the room by 11:00 a.m;G
581;29;According to the text, on what basis is the accommodation contract concluded at Grandium Hotel Prague?;The accommodation contract at Grandium Hotel Prague is concluded on the basis of the accommodation contract pursuant to the regulation § 2326 and the law No;G
582;29;What is the purpose of the deposit requested by the Lodging Provider upon the Guest's arrival?;The Lodging Provider may require a deposit of EUR 50 per room/night upon the Guest's arrival, refundable on departure or used to cover potential damages.;G
583;29;How does the text describe the Guest's responsibilities during their stay at the hotel?;The Guest is responsible for reading and following the Accommodation Rules, paying the accommodation price, proper use of premises, maintaining order, and reporting any damage caused.;G
584;29;What does the Lodging Provider do if the Guest leaves their belongings in the room after the end of their stay and the accommodation is not paid?;If the Guest leaves belongings after the end of the stay and accommodation is not paid, the Lodging Provider moves the items away and stores them until payment.;G
585;29;How is the Lodging Provider's responsibility limited for damage to brought possessions, according to the text?;The Lodging Provider's responsibility for damage to brought possessions is limited to 100 times the price of accommodation per 1 day.;G
586;29;What should the Guest ensure before leaving the hotel room, according to the text?;Before leaving the hotel room, the Guest should ensure that all service charges are properly paid.;G
587;29;How is the accommodation contract concluded, and what are the conditions for payment of the service cost mentioned in the contract?;The accommodation contract is concluded by making a reservation in written form or by phone and confirming this reservation in written form;G
588;29;What is the procedure for cancellation of a reservation, withdrawal from the contract before being accommodated, and failure to arrive for check-in?;The Guest can withdraw from the Accommodation Contract before the date of check-in without stating a reason;G
589;29;How is the accommodation period arranged, and when does the accommodation of guests typically take place?;The accommodation period is arranged during the Guest's check-in, and accommodation typically takes place from 15:00 (3 p.m.) on the day of the announced arrival.;G
590;29;What is the Lodging Provider's responsibility for damage to left possessions, and what regulations does it follow?;The responsibility of the Lodging Provider for damage to left possessions follows the regulation §2945 et seq;G
591;29;What is the Lodging Provider's procedure regarding loss and findings, and for how long are they kept?;Loss and findings are kept for a maximum of 3 months after departure and can be sent to the client upon request and payment of postage.;G
592;29;How does the text define the responsibility of the Guest for caused damage to the Lodging Provider's property?;The Guest is responsible for caused damage to the Lodging Provider's property, covered by the paid deposit.;G
593;29;Under what circumstances is the Lodging Provider entitled to terminate the accommodation contract before the agreed period without notice?;"The Lodging Provider is entitled to terminate the accommodation contract before the expiration of the agreed period, even without notice, if the Guest does not comply with obligations arising from the accommodation contract, the Accommodation Rules, and / or the price list of the Lodging Provider, or otherwise violates good manners of the Hotel (""Misconduct"") after being warned.";G
594;30;What must guests do with their set of keys when leaving the hotel?;Guests must hand over their set of keys when leaving the hotel.;G
595;30;What is the refund policy for a reservation cancelled 1-2 days before the scheduled arrival?;For a reservation cancelled 1-2 days before the scheduled arrival, 50% of the deposit will be refunded.;G
596;30;What is the requirement related to accommodation payment during check-in?;Accommodation payment is necessary at the time of check-in.;G
597;30;What type of establishment is La Posada del Río Sonora?;La Posada del Río Sonora is a family rest establishment.;G
598;30;When is the food consumption service of the stay required to be covered?;The food consumption service must be covered at the time of departure.;G
599;30;In case of a reservation cancellation 5-7 days prior to arrival, what refund percentage applies?;In case of a reservation cancellation 5-7 days prior to arrival, 25% of the deposit will be refunded.;G
600;30;What precautions are advised regarding the responsibility for lost or misplaced items?;Guests should not leave valuables in their cars within view and should lock their doors.;G
601;30;What is strictly forbidden at the hotel to ensure the comfort of all guests?;It is strictly forbidden to annoy and not respect the rest of other guests.;G
602;30;At what time does the check-in process start, according to the hotel rules?;Check-in time starts from 1:00 pm.;G
603;30;Why is it strictly forbidden to bring alcoholic beverages into the hotel?;Bringing alcoholic beverages into the hotel is strictly forbidden to ensure guest comfort.;G
604;30;What is the consequence of not returning or losing the room keys?;Not returning or losing room keys results in a $20.00 replacement fee.;G
605;30;What is the procedure for check-in, and what documentation is required from guests?;Guests are required to identify themselves and register by filling out a registration sheet during check-in.;G
606;30;When should guests request an invoice if needed, and what information is required for it?;Guests should request an invoice at the time of check-in, providing all necessary data.;G
607;30;What is the check-out time at La Posada del Río Sonora, and is there a tolerance period?;Check-out time is at 11:00 am, with a delivery tolerance of 15 minutes.;G
608;30;Is there a policy regarding pets, and what are the conditions for their stay at the hotel?;Pets are welcome, but a non-refundable pet fee will be charged, and pets should not be left alone in a room.;G
609;30;Where is smoking permitted within the hotel premises, and where is it strictly prohibited?;Smoking is not permitted in rooms, the restaurant, or the TV area;G
610;30;What safety measure is mentioned, and where are they available throughout the hotel?;Fire extinguishers are available throughout the hotel.;G
611;30;What deposit is required for lodging, and when is it necessary to make this payment?;A 50% deposit is required for lodging, and it is necessary with each reservation.;G
612;30;What is the refund policy for a cancelled reservation or a no-show on the day of arrival?;In the case of a cancelled reservation or a no-show on the day of arrival, no refund applies.;G
613;30;What energy-saving measures are guests requested to take when leaving their rooms?;Guests are requested to discontinue the use of air conditioners, heaters, and lights when leaving their rooms.;G
633;32;Is accommodation with a pet allowed without any conditions?;Accommodation with a pet is allowed, but with an additional cost.;G
634;32;According to the text, in what situations is the hotel not liable for damages incurred by the guest?;The hotel is not liable for any damages incurred by the guest outside the Hotel, including the parking.;G
635;32;What financial responsibility does the guest assume in case of damage caused by a pet?;In case of damage caused by a pet, the guest assumes 100 percent financial responsibility for this.;G
636;32;What damages is the hotel not liable for, including an example mentioned in the text?;The hotel is not liable for loss or damage to jewelry, money, valuables, or personal belongings loosely laid in the hotel room.;G
637;32;During which hours is a guest obliged to observe a night's rest in the hotel?;From 22:00 to 7:00, the guest is obliged to observe a night's rest.;G
638;32;During which hours is a guest obliged to observe a night's rest, according to the text?;From 22:00 to 7:00, the guest is obliged to observe a night's rest.;G
639;32;In case of damage caused by a pet, what financial responsibility does the guest assume?;In case of damage caused by a pet, the guest assumes 100 percent financial responsibility for this.;G
640;32;What is the penalty for smoking in the hotel room or other areas, as mentioned in the text?;The penalty for smoking in the hotel room or other areas is 150 €.;G
641;32;What recommendation is given to guests regarding the safety of their personal belongings?;Guests are recommended to use the safe deposit box at the reception for the safety of their personal belongings.;G
642;32;According to the text, who is responsible for damage caused to the customer during their stay in the hotel?;The operator is responsible for damage caused to the customer during their stay in the hotel.;G
643;32;What is the consequence for not vacating the room after 15:00?;If the room is not vacated after 15:00, the full amount per room will be provided by the guest.;G
644;32;What is recommended to guests for the safety of their valuables and personal belongings?;Guests are recommended to use the safe deposit box for the safety of their valuables and personal belongings.;G
645;32;According to the text, who is responsible for damages caused to the hotel property, and based on what regulations?;The guest is responsible for damages caused to the hotel property according to the valid legal regulations of the Slovak Republic.;G
646;32;Is accommodation with a pet allowed, and what condition is associated with it?;Accommodation with a pet is allowed, but with an additional cost.;G
647;32;What responsibility does the guest hold for damages caused to the hotel property, and based on what regulations?;The guest is responsible for damages caused to the hotel property according to the valid legal regulations of the Slovak Republic.;G
648;32;What fee will be charged if the room is not vacated between 12:00 - 15:00?;A fee of 50% of the accommodation price will be charged if the room is not vacated between 12:00 - 15:00.;G
649;32;What is the consequence for not vacating the room after 15:00, according to the text?;If the room is not vacated after 15:00, the full amount per room will be provided by the guest.;G
650;32;What specific areas are mentioned where smoking is strictly forbidden in the hotel?;Smoking is strictly forbidden in the hotel room and other areas of the hotel (also in the toilet or from the window).;G
651;32;What is the specific fine amount mentioned for smoking violations in the hotel?;The fine for smoking violations in the hotel is 150 €.;G
652;32;At what time does the hotel charge a fee if the room is not vacated?;If the room is not vacated between 12:00 - 15:00, a fee of 50% of the accommodation price will be charged.;G
653;33;What is the purpose of the Hotel Rules and Regulations for GREEN INN in Ostravice?;The purpose of the Hotel Rules and Regulations for GREEN INN in Ostravice is to set clearly defined rules, rights, and obligations for all guests accommodated in the hotel.;G
654;33;What is the contact number for the night guard in case of a serious problem between 7:00 p.m;The contact number for the night guard in case of a serious problem between 7:00 p.m;G
655;33;What security measure is mentioned regarding the sauna in the wellness area?;For security reasons, the sauna is automatically switched off at 10 p.m.;G
656;33;What is the role of the accommodated guest in relation to the Hotel Rules and Regulations?;Each accommodated guest is under strict obligation to observe the provisions set forth in the Hotel Rules and Regulations.;G
657;33;Where are the designated smoking areas within the hotel premises?;Designated smoking areas are on the balconies, terrace, or the space in front of the building.;G
658;33;What obligations do guests have in terms of room maintenance when leaving?;Each accommodated guest is under strict obligation to observe the provisions set forth in the Hotel Rules and Regulations.;G
659;33;Is there a password required for the Wi-Fi internet connection in the hotel?;No, there is no password required for the Wi-Fi internet connection in the hotel.;G
660;33;Who maintains the accommodated guests registry, and what role do they play in providing room keys?;The accommodated guests registry is maintained by the front desk clerk, who also provides the room keys.;G
661;33;How can guests reach the front desk from their hotel room, and what is the contact number for urgent matters between 7:00 p.m;Guests can reach the front desk from their hotel room by dialing 1555;G
662;33;Until what time is buffet-style breakfast served, and when is the restaurant open until?;Buffet-style breakfast is served from 7 a.m;G
663;33;What procedure is advised for guests who consume goods from the minibar, and when should it be done?;In case of consuming any goods from the minibar, guests should fill in the form available on the table and hand it in at the front desk when settling the bill upon check-out.;G
664;33;What is the rule regarding spiked golf shoes when entering the hotel building, and where should guests change their shoes?;It is forbidden to enter the hotel building in spiked golf shoes;G
665;33;Is there a fee for entry to the wellness area, and what is the mandatory requirement for accessing it?;Entry to the wellness area is free for all hotel guests, but prior booking at the front desk is mandatory;G
666;33;By what time are guests required to leave their rooms when checking out, and what actions are they obliged to take before leaving?;Guests are required to leave their room by 10 a.m;G
667;33;What is the procedure for guests who consume items from the minibar, and when should it be completed?;In case of consuming any items from the minibar, guests should fill in the form and hand it in at the front desk when settling the bill upon check-out.;G
668;33;What is the policy for accessing the wellness area, and what is the mandatory requirement for it?;Entry to the wellness area is free for all hotel guests, but prior booking at the front desk is mandatory.;G
669;33;What security measure is in place for the sauna, and at what time is it automatically switched off?;For security reasons, the sauna is automatically switched off at 10 p.m.;G
670;33;What time are guests required to leave their rooms during check-out, and what actions are they required to take before leaving?;Guests are required to leave their room by 10 a.m;G
671;33;What is forbidden in all rooms regarding smoking and electrical appliances that are not part of the room amenities?;Smoking and usage of any electrical appliances (such as cookers, irons, or electric kettles) which are not part of the room amenities are forbidden in all rooms.;G
672;33;What is forbidden in terms of footwear when entering the hotel building?;It is forbidden to enter the hotel building in spiked golf shoes.;G
673;34;How many bed rooms with attached bathrooms should a Boutique Hotel have according to the guidelines?;A Boutique Hotel should have a minimum of 10 bedrooms with attached bathrooms.;G
