;Indice;Domanda ChatGTP;Risposta ChatGTP;Valutazione ChatGTP
0;0;What information is provided at check-in regarding Pool and Fitness Room hours and guidelines?;Pool and Fitness Room hours and guidelines are provided at check-in.;G
1;0;Who is responsible for the safety and welfare of the youth according to the guidelines?;The adult(s) are responsible for the safety and welfare of the youth according to the guidelines.;G
2;0;What is the specified purpose of using elevators in the hotel?;Elevators are to be used for the sole purpose of transporting guests and their luggage to the appropriate floor of the hotel.;G
3;0;Is there a dress code for the food and beverage areas in the hotel?;Yes, there is a dress code for the food and beverage areas in the hotel.;G
4;0;Where can towels for the Fitness Room and Pool be found?;Towels for the Fitness Room and Pool are located in those areas.;G
5;0;What is the consequence for smoking in a non-smoking room?;Smoking in a non-smoking room will result in an additional $250.00 cleaning charge.;G
6;0;How are the rules and times for the Pool and Fitness Room enforced?;All rules and times for the Pool and Fitness Room will be enforced to allow efficient operation of the hotel and for the comfort and safety of all guests.;S
7;0;What is the consequence for a guest in violation of the rules?;Any guest in violation of these rules may be asked to leave the hotel with no refund.;G
8;0;Are room keys issued to youth under 18 at any time?;No, room keys will not be issued to youth under 18 at any time.;G
9;0;Where can guests obtain extra copies of these rules if needed?;Extra copies of these rules are available at the Front Desk upon request.;G
10;0;What room has been provided for teams to use throughout their stay?;The Grand Teton Room has been provided for teams to use throughout their stay.;G
11;0;What are the requirements for attire in the food and beverage areas?;Shoes and shirts must be worn at all times in the food and beverage areas.;G
12;0;Where is the designated location for team meetings, events, and as a hospitality room?;The Grand Teton Room is the designated location for team meetings, events, and as a hospitality room.;G
13;0;What is the purpose of fire alarms, and when are they supposed to be used?;Fire alarms are to be used only in case of a true emergency.;G
14;0;What are the consequences of a false fire alarm, and who will investigate it?;Any false alarm will be investigated by the Jackson Hole Fire Department, and the cost of responding to an intentional false alarm will be passed on to the person(s) responsible for the false report.;G
15;0;What activities are not accepted on the hotel property, including hallways, lobby areas, and guest rooms?;Running, shouting, roughhousing, or horseplay are not accepted on the hotel property, including hallways, lobby areas, stairways, elevators, food service areas, and guest rooms.;G
16;0;At what time is the check-out time, and what is the consequence for not honoring it?;Check-out time is Noon, and it must be honored to avoid charges for an additional day.;G
17;0;Are cleats allowed to be worn inside the hotel at any time?;Cleats are not to be worn inside the hotel at any time.;G
18;0;Are towels from guest rooms allowed to be taken to the Pool or Fitness Room?;Towels from guest rooms are not to be taken to the Pool or Fitness Room.;G
19;0;Who will receive the room keys at check-in?;Chaperones/coaches will receive the room keys at check-in.;G
20;1;How does the text handle the issue of exceeding the specified number of persons per room?;The hotel reserves the right to take various actions if the specified number of persons per room is exceeded.;S
21;1;What types of damages may result in charges to the guest's invoice upon departure?;Damages such as breakage, spillage, stains, lost keys, fobs, and towels may result in charges.;G
22;1;What responsibilities do guests have in terms of their behavior while staying at the hotel?;Guests must comply with the hotel's requirements and instructions, ensuring they do not hinder other guests.;G
23;1;What should guests do if they or someone in their party has allergies or phobias?;Guests should advise the hotel in advance of any allergies or phobias.;G
24;1;What payment methods are accepted by the hotel?;The hotel accepts cash and most credit/debit cards but does not accept cheques.;G
25;1;Under what conditions are guide dogs and service dogs allowed in the hotel?;Only guide dogs and service dogs are allowed in the hotel.;G
26;1;Which law governs the relationship between the parties, according to the text?;South African law and the jurisdiction of South African courts govern the relationship between the parties.;G
27;1;How does the hotel handle special requests from guests?;The hotel does not guarantee meeting special requests but will make best endeavors to do so.;G
28;1;What types of food preferences may result in additional charges?;Certain food preferences, such as Halaal or Kosher, may result in additional charges.;G
29;1;Why is it strongly advised for guests to arrange adequate insurance cover?;Adequate insurance cover is advised for reasons such as cancellation due to illness or injury.;G
30;1;What does the text say about the hotel's liability for loss or damage to guest property?;The hotel, its directors, members, partners, employees, and agents are exempt from liability for loss or damage to guest property unless section 61 of the CPA applies.;G
31;1;What is the hotel's policy regarding check-in, check-out, and late arrivals?;Guests must adhere to check-in and check-out times, and late arrivals must be notified in advance.;G
32;1;What is the cancellation policy for individual bookings, and what are the associated fees?;Cancellation fees for individual bookings vary based on the timing of the cancellation.;S
33;1;How is Wi-Fi usage regulated by the hotel, and is there a charge for it?;Wi-Fi is available free of charge, and guests should check availability and password upon arrival.;G
34;1;How does the hotel handle lost property, and for how long is it kept?;The hotel will make best endeavors to return lost belongings, but any costs incurred are the guest's responsibility.;G
35;1;What conditions does the registration card impose on guests, and what is their responsibility regarding personal information?;The registration card imposes various conditions, including indemnifying the hotel against responsibility for injury or loss, accepting payment responsibility, adhering to check-out times, and consenting to the use of personal information for loyalty programs and special offers;G
36;1;What liabilities does the Principal Customer have during the booking period?;The Principal Customer is personally liable for the booking and any related expenses or damages.;G
37;1;"Who is considered the ""Principal Customer"" in the booking process?";"The person making the booking is the ""Principal Customer.""";G
38;1;What is the policy regarding parking at the hotel?;Parking is allowed in designated areas, entirely at guests' risk, and limited to one vehicle per room unless a prior arrangement has been made.;G
39;1;Where is smoking allowed in the hotel, according to the text?;Smoking is only allowed in designated areas, and applicable legislation must be complied with.;G
40;2;What are the conditions under which the Customer can withdraw from the Contract without incurring payment or damage claims?;The Customer can withdraw from the Contract under specific conditions, such as a right of withdrawal explicitly agreed upon in the Contract, a statutory right of withdrawal, or explicit consent from the Hotel.;G
41;2;How long does the prescription period last for claims against the Hotel?;Claims against the Hotel generally prescribe one year after the commencement of the statutory limitation period.;G
42;2;When does the Hotel Accommodation Contract come into force?;The Hotel Accommodation Contract comes into force upon the Hotel's acceptance of the Customer's offer.;G
43;2;Who are the contracting parties in the Hotel Accommodation Contract?;Mövenpick Hotels Deutschland GmbH (Operating Company) and the Customer are the contracting parties in the Hotel Accommodation Contract.;G
44;2;What are the restrictions and regulations related to smoking in the hotel rooms and public areas?;Smoking, including e-cigarettes, is prohibited in non-smoking rooms and public areas;G
45;2;What obligations does the Hotel have in terms of room availability and services according to the Contract?;The Hotel is obliged to keep available the rooms reserved by the Customer and to render the agreed services;G
46;2;Under what circumstances can the Hotel demand an advance payment or security from the Customer?;Upon conclusion of the Contract, the Hotel may require a reasonable advance payment or the provision of security from the Customer.;G
47;2;What is the preferred language version in case of discrepancies in translations of the General Terms and Conditions?;The approved English version of the General Terms and Conditions takes precedence over its translations.;G
48;2;What is the governing law for the Contract and these General Terms and Conditions?;The Contract and General Terms and Conditions are governed exclusively by German substantive law, without the application of its conflict of law’s provisions;G
49;2;How does the hotel handle parcels and other postal/mail items?;Parcels and other postal items are accepted only if pre-registered and addressed to an overnight guest or an event known to the hotel;G
50;2;What are the payment obligations of the Customer to the Hotel according to the terms and conditions?;The Customer is obliged to pay the Hotel the agreed or applicable prices for room rental and other services provided.;G
51;2;What is the scope of applicability for the General Terms and Conditions provided by Mövenpick Hotels Deutschland GmbH?;The General Terms and Conditions apply when the Customer enters into a contract for the rent of hotel rooms and other services in one of the hotels operated by Mövenpick Hotels Deutschland GmbH in Germany.;G
52;2;In what situations can the Hotel withdraw from the Contract without consequences?;The Hotel can withdraw from the Contract under certain circumstances, including the Customer's failure to waive the right of withdrawal, non-payment of an advance payment or security, or a materially justifiable cause.;G
53;2;What precautions should the Customer take regarding property brought into the Hotel?;The Hotel recommends using the safe at the Hotel reception for valuable items;G
54;2;What is the liability of the Hotel for damages, and under what conditions is it limited?;The Hotel is liable for damages caused with intent or gross negligence;G
55;2;How does the Hotel handle wake-up calls, messages, mail, and deliveries for guests?;Wake-up calls are carried out diligently, and the Hotel handles messages, mail, and deliveries with care;G
56;2;Does the hotel participate in extrajudicial resolution of consumer disputes, and if so, where can it be accessed?;The hotel does not participate in dispute resolution proceedings held before consumer dispute resolution bodies.;S
57;2;What are the rules regarding internet use and file sharing in the hotel?;The customer is not permitted to carry out illegal file sharing using the hotel's internet connection;G
58;2;What are the consequences if a room in the reserved category is not available upon the customer's arrival?;If a room in the reserved category is not available upon the customer's arrival, the Hotel will provide a room in the next higher category;G
59;2;Where can guests find detailed information about the handling of their personal data?;"Detailed information about the handling of personal data can be found in the ""Privacy Notice for Guests,"" available at the Reception.";G
60;3;What are the services provided by Hotel2Stay according to the document?;The services provided by Hotel2Stay include offering food & beverages, reception services, cleaning services, the use of common areas, the rooftop terrace, launderette, sauna spots, and the use of a gym.;G
61;3;What are the acceptable payment methods for Hotel2Stay?;Hotel2Stay accepts payments by credit card, debit card, or via wire transfer (cards accepted such as Visa, MasterCard, American Express, or Maestro).;G
62;3;How does the document address safety concerns for guests?;Hotel2Stay ensures safety by having 24-hour surveillance of staff members and recording incidents through CCTV.;G
63;3;What is the purpose of the House rules at Hotel2Stay?;The House rules at Hotel2Stay are set to preserve order, peace, and quietness in the hotel.;G
64;3;"How is the term ""Guest"" defined in the document?";"In the document, a ""Guest"" is defined as the person to whom Hotel2Stay provides services, and it may also include the person accompanying the Guest.";G
65;3;How does Hotel2Stay handle overbooking situations or Force Majeure events?;In overbooking situations or Force Majeure events, Hotel2Stay may offer the Guest other hotel accommodations of at least comparable quality;G
66;3;What is the Minimum Age requirement for a Guest to make a reservation?;The Minimum Age for a Guest to make a reservation and stay in the hotel is 21 years.;G
67;3;What is the maximum length of stay Hotel2Stay offers?;Hotel2Stay offers a maximum stay of 6 months within an 18-month period.;G
68;3;What is the address of Hotel2Stay?;The address of Hotel2Stay is Tempelhofstraat 2, 1043 EC Amsterdam, The Netherlands.;G
69;3;"What does the term ""Guarantor"" refer to?";"The term ""Guarantor"" refers to the party who guarantees the payment of the hotel accommodation fee and/or any outstanding charges.";G
70;3;How does Hotel2Stay handle security deposits during check-in?;During check-in, guests are required to pay a security deposit of €100, which can be paid for by credit card (preauthorization) or debit card (actual payment) and will be refunded after the check-out day.;G
71;3;What is the procedure for canceling an Extended Stay Booking?;The procedure for canceling an Extended Stay Booking includes providing a one (1) month prior notice of cancellation/replacement booking;G
72;3;How does Hotel2Stay handle deposits and room inventory checks?;Hotel2Stay may require the Guest to pay a deposit of €300 for unpaid invoices or damages;G
73;3;What liabilities do guests have for damages or loss at Hotel2Stay?;Guests are entirely responsible for the conduct and behavior of the people they bring into Hotel2Stay and will be liable for any damages or costs incurred.;G
74;3;Under what circumstances can Hotel2Stay terminate its services to a Guest?;Hotel2Stay can terminate its services to a Guest in case of violation of the Terms & Conditions and/or House rules;G
75;3;How long is an Optional Booking valid unless specified otherwise?;Optional Bookings are valid for a period of 48 hours unless another period has been confirmed by Hotel2Stay in writing.;G
76;3;What are the check-in and check-out times for guests?;The check-in time is at 3 p.m;G
77;3;What is the process for filing complaints with Hotel2Stay?;Complaints regarding the Hotel Agreement must be made in writing by the Contracting Party and/or Guest and submitted immediately after discovering the failure to perform;G
78;3;What jurisdiction is specified for disputes related to the Hotel Agreement?;The document specifies that the Hotel Agreement is governed by the laws of the Netherlands, and the competent court in Amsterdam, The Netherlands, has exclusive jurisdiction over disputes related to the Hotel Agreement.;G
79;3;How does the document address force majeure situations?;The document addresses force majeure situations, and in such cases, Hotel2Stay is entitled to suspend or cancel the Hotel Agreement without liability for harm or loss.;G
80;4;What is the hotel's policy on smoking within the entire hotel building?;Smoking is strictly prohibited in the entire hotel building.;G
81;4;What specific request does the hotel have for guests regarding environmentally friendly behavior during their stay?;Guests are asked to behave in an environmentally friendly manner, especially with regard to the use of water and electricity.;G
82;4;Who is considered materially liable for any damage to the hotel's furniture and technical equipment?;The hotel guest is materially liable for any damage to the hotel's furniture and technical equipment caused through his or her own fault or that of his or her visitors.;G
83;4;Does the hotel accept liability for luggage deposited in the specially designated space?;The hotel offers the possibility of depositing luggage in a specially designated space but accepts no liability for it.;G
84;4;What does the hotel expressly disclaim any liability for in the provided rules?;The hotel expressly disclaims any liability for the loss of valuables, especially jewelry and cash.;G
85;4;What additional charge is mentioned for a late check-in or check-out?;An additional charge of 50 CH is mentioned for a late check-in or check-out.;G
86;4;At what time can a booked room be occupied on the day of arrival at the 6532 SmartHotel?;The booked room can be occupied from 15:00 on the day of arrival.;G
87;4;What is strictly forbidden in the event of a fire according to the hotel rules?;In the event of an emergency, guests must use the indicated escape routes and emergency exits, and it is strictly forbidden to use the lift in the event of a fire.;G
88;4;What happens if a guest has a late departure, according to the hotel rules?;If a guest has a late departure, the room will be charged for an additional night.;G
89;4;What action does the hotel request guests to take regarding found or lost items?;Guests are kindly asked to report any found or lost items to reception.;G
90;4;Until what time must noise in the rooms be kept down in all rooms, corridors, and stairwells?;Noise in the room must be kept down from 10 pm in all rooms, corridors, and stairwells.;G
91;4;What is the designated area for smoking, and what is the hotel's stance on it?;Guests are kindly asked to use the designated outdoor area for smoking.;G
92;4;What is the additional charge for bringing pets into the hotel, and what condition must be met regarding their supervision?;Pets are allowed in the hotel under supervision for an additional charge of CHF 20.00 per day, but they are not allowed to be left alone in the room.;G
93;4;Are pets allowed to be left alone in the hotel room, according to the rules?;No, pets are not allowed to be left alone in the room.;G
94;4;During the week, at what time is breakfast served at the hotel?;Breakfast is served from 07:00 to 10:00 during the week.;G
95;4;In case of medical needs, where should guests consult for useful numbers?;"In case of medical needs, guests should consult the map in their room under ""useful numbers.""";G
96;4;Is it permissible for a hotel guest to leave the room to another person without the hotel's consent?;No, a hotel guest may not leave the room to another person without the written consent of the hotel.;G
97;4;"How does the hotel define a ""hotel guest"" in the provided rules?";A hotel guest is any person staying in the hotel who has concluded a hotel contract or has registered something that suggests that he or she wants to conclude a hotel contract.;G
98;4;What action is the hotel staff authorized to take if a guest disturbs others or violates the rules?;The hotel staff is authorized to refuse services to a person who violates this rule.;G
99;4;By what time are guests asked to vacate their hotel rooms on the day of departure?;Guests are asked to vacate their hotel room by 10:30 a.m;G
100;5;Where does the text suggest guests keep their valuables for security?;Guests are advised to keep their valuables in the special safes in their rooms for added security.;G
101;5;In case of non-compliance with rules, who has the authority to terminate the accommodation of guests?;In case of non-compliance with rules, the hotel management has the authority to terminate the accommodation of guests.;G
102;5;What action does the text strictly forbid in terms of discarding items or garbage?;It is strictly forbidden to discard items or garbage from the windows or balconies of the hotel.;G
103;5;What responsibility does the hotel management disclaim in relation to accidents or injuries?;The hotel management disclaims responsibility in relation to accidents or injuries.;S
104;5;What locations should guests accompany children, as mentioned in the rules?;Guests should accompany children in locations such as stairways.;G
105;5;What is the primary purpose of the rooms in the hotel, according to the text?;The primary purpose of the rooms in the hotel is for accommodation services.;G
106;5;What is the hotel management's stance on lost or stolen belongings of guests?;The hotel management does not accept responsibility for lost or stolen belongings of guests.;G
107;5;How does the text advise guests to handle their valuables for added security?;The text does not specifically advise guests on how to handle their valuables for added security.;S
108;5;What specific behavior is strictly forbidden among the hotel guests, according to the rules?;Harassing each other or demonstrating disturbing behavior is strictly forbidden among hotel guests.;G
109;5;How does the text address the issue of noise within the hotel premises?;The text suggests that guests maintain a reasonable volume level to respect the comfort of other guests.;G
110;5;What requirement does the text mention for individuals staying in a room?;Individuals staying in a room must be registered at the reception.;G
111;5;According to the rules and regulations, what action can the hotel management take if guests fail to comply with the rules?;The hotel management reserves the right to terminate the accommodation of guests who fail to comply with the rules.;G
112;5;Why should children be accompanied in specific locations such as stairways?;Children should be accompanied in locations such as stairways to ensure their safety.;G
113;5;What consequences are mentioned for unregistered visitors attempting to enter guest rooms or other hotel areas?;Unregistered visitors attempting to enter guest rooms or other hotel areas may face an additional fee charged to the registered guest's account.;G
114;5;What does the hotel management disclaim responsibility for in terms of accidents or injuries?;The hotel management disclaims responsibility for any accident or injury beyond its control.;G
115;5;What is the consequence for unregistered visitors trying to enter guest rooms or hotel areas?;Unregistered visitors trying to enter guest rooms or hotel areas may face an additional fee.;G
116;5;What does the hotel management not accept responsibility for in terms of accidents or injuries?;The hotel management does not accept responsibility for any accident or injury beyond its control.;G
117;5;What responsibility do guests have concerning their belongings, and what is the hotel's stance on lost or stolen items?;Guests are entirely responsible for their belongings, and the hotel does not accept responsibility for lost or stolen items.;G
118;5;Is there any specific location mentioned for guests to keep their valuables, and what is it?;The text suggests keeping valuables in the special safes in the rooms.;G
119;5;What specific action is strictly forbidden concerning the disposal of items or garbage from the hotel?;It is strictly forbidden to discard items or garbage from the windows or balconies of the hotel.;G
120;6;What restrictions are placed on guests regarding moving furniture and using electrical appliances in their rooms?;Guests may not move furniture or interfere with electrical appliances without the consent of the hotel management.;G
121;6;Under what conditions is accommodation in the hotel permitted, concerning health and substance influence?;Accommodation in the hotel is permitted only for persons without infectious diseases and not visibly under the influence of alcohol or drugs.;G
122;6;According to the hotel regulations, when are orders for accommodation services considered mutually binding?;Orders for accommodation services are considered mutually binding when made in writing or by other means, confirmed by the hotel, and not cancelled by the customer in a timely manner.;G
123;6;During which hours are guests required to maintain low noise levels in the hotel?;Between 10:00 pm and 06:00 am, guests must maintain low noise levels.;G
124;6;What happens if a guest fails to vacate the room by the designated time on the departure day?;Failure to vacate the room by the designated time may result in an additional night's accommodation fee.;G
125;6;What is the hotel's policy regarding room extensions for guests?;In the case of a room extension, the reception may offer the guest a different room than the one originally assigned.;G
126;6;What are the regulations regarding leaving children under 12 years of age unattended in hotel rooms?;"Children under 12 years of age must not be left unattended; supervision is required in common areas and the use of the lift.";G
127;6;What responsibilities do guests have when leaving their room, particularly regarding water taps and electrical appliances?;"Guests must turn off water taps and electrical appliances when leaving the room; responsibility for damages lies with the guests.";G
128;6;What personal document must a guest present for registration at the hotel?;A guest must present a personal document (citizen's identification card) or a valid passport for registration.;G
129;6;What is the procedure for payment of accommodation and other services, according to the hotel regulations?;"Guests must pay the agreed-upon price upon arrival; on-site payments for services are due at the beginning of the stay.";G
